{
  "$schema": "https://json-schema.org/draft/2020-12/schema",
  "$id": "https://cfengine.com/policy-builder/schemas/block-descriptor.v1.json",
  "title": "Block Descriptor",
  "description": "Static definition of a block type. Consumed by the renderer (palette, Properties form) and by the Python compiler that turns block instances into CFEngine policy — see blocks/README.md for the compiler contract.",
  "type": "object",
  "additionalProperties": false,
  "required": [
    "schema_version",
    "id",
    "version",
    "name",
    "category",
    "compile_target"
  ],
  "oneOf": [
    {
      "required": [
        "steps",
        "parameters"
      ],
      "not": {
        "required": [
          "value_sources"
        ]
      }
    },
    {
      "required": [
        "value_sources"
      ],
      "not": {
        "required": [
          "steps"
        ]
      }
    }
  ],
  "properties": {
    "$schema": {
      "type": "string"
    },
    "schema_version": {
      "const": 1
    },
    "id": {
      "type": "string",
      "pattern": "^[a-z][a-z0-9-]*$",
      "description": "Stable identifier, stored in every instance. Custom blocks use a \"custom-\" prefix so they can't collide with built-ins."
    },
    "version": {
      "type": "integer",
      "minimum": 1,
      "description": "This block's revision. Bump it on any change that affects stored instances or compiled output; migrations key on (id, version)."
    },
    "name": {
      "type": "string",
      "description": "Shown in the palette."
    },
    "description": {
      "type": "string",
      "maxLength": 80,
      "description": "One short sentence, shown under the name and matched by palette search."
    },
    "custom": {
      "type": "boolean",
      "description": "Custom CFEngine: its promises and definitions parameters are CFEngine text, compiled into a bundle of the block's own ({\"custom_bundle\": true} names it) and checked with the linter."
    },
    "category": {
      "type": "string",
      "description": "Palette grouping."
    },
    "requires_module": {
      "type": "string",
      "description": "The CFEngine Build module providing the block's custom promise type: adding the block adds the module to the project."
    },
    "compile_target": {
      "enum": [
        "own_bundle",
        "file_vars"
      ],
      "description": "own_bundle: a sequenced block — its own bundle agent, called from the file's entry bundle, with outcomes and arrows. file_vars: entries compile into the file's shared `bundle common vars` (Define Variable / Define Class) — not sequenced, no arrows."
    },
    "steps": {
      "type": "array",
      "minItems": 1,
      "items": {
        "$ref": "#/$defs/step"
      },
      "description": "Ordered promises; each compiles to its own chained bundle (methods:, in order), which is how a block controls cross-promise-type ordering."
    },
    "parameters": {
      "type": "array",
      "items": {
        "$ref": "common.v1.json#/$defs/parameter"
      },
      "description": "With steps: the block's parameters. With value_sources: those shared by every source (e.g. the variable name)."
    },
    "value_sources": {
      "type": "array",
      "minItems": 1,
      "items": {
        "$ref": "#/$defs/valueSource"
      },
      "description": "Blocks whose promise varies by how the value is produced (Define Variable: literal vs command output vs file ...)."
    },
    "value_source_label": {
      "type": "string",
      "description": "Label of the value-source selector (default \"Value source\")."
    },
    "arrow_default_outcome": {
      "enum": [
        "kept",
        "repaired",
        "not_kept"
      ],
      "description": "What a newly drawn arrow from this block waits for (default: kept or repaired). Blocks whose success is always \"repaired\" (commands) set that."
    },
    "outcome_step": {
      "type": "integer",
      "minimum": 0,
      "description": "Index into steps whose outcome counts as the block's (for arrows), instead of the rolled-up methods: outcome. The compiler puts classes => results(\"namespace\", ...) on that step."
    },
    "entries": {
      "type": "object",
      "additionalProperties": false,
      "required": [
        "name_param",
        "noun",
        "noun_plural"
      ],
      "description": "One instance holds a list of definitions (several variables/classes); each entry has its own name, value source and params.",
      "properties": {
        "name_param": {
          "type": "string",
          "description": "The shared parameter that is each entry's defined name."
        },
        "noun": {
          "type": "string"
        },
        "noun_plural": {
          "type": "string"
        }
      }
    }
  },
  "$defs": {
    "valueSource": {
      "type": "object",
      "additionalProperties": false,
      "required": [
        "id",
        "label",
        "parameters",
        "steps"
      ],
      "properties": {
        "id": {
          "type": "string",
          "pattern": "^[a-z][a-z0-9-]*$"
        },
        "label": {
          "type": "string"
        },
        "badge": {
          "type": "string",
          "description": "Short hint, e.g. the function it compiles to."
        },
        "help": {
          "type": "string"
        },
        "summary": {
          "$ref": "common.v1.json#/$defs/template",
          "description": "One line for the generated policy's comment when the value goes through a chain or feeds a parameter, e.g. \"The {{output}} of {{command}}\"."
        },
        "group": {
          "type": "string",
          "description": "Header this source is listed under in the selector."
        },
        "value_type": {
          "enum": [
            "string",
            "slist",
            "data"
          ],
          "description": "vars sources: the type the source produces — what a decorator chain starts from, and the vars attribute when there's no chain (data can't be transformed)."
        },
        "literal": {
          "type": "boolean",
          "description": "The value is typed in (literal, list, JSON): no data chain is drawn for it and decorators aren't offered."
        },
        "parameters": {
          "type": "array",
          "items": {
            "$ref": "common.v1.json#/$defs/parameter"
          }
        },
        "steps": {
          "type": "array",
          "minItems": 1,
          "maxItems": 1,
          "items": {
            "$ref": "#/$defs/step"
          }
        }
      }
    },
    "step": {
      "type": "object",
      "additionalProperties": false,
      "required": [
        "promise_type",
        "promiser"
      ],
      "properties": {
        "promise_type": {
          "enum": [
            "vars",
            "classes",
            "users",
            "files",
            "packages",
            "methods",
            "processes",
            "services",
            "commands",
            "storage",
            "reports",
            "git",
            "systemd",
            "http",
            "ansible"
          ],
          "description": "git, systemd, http and ansible are custom promise types: the block's requires_module provides them."
        },
        "promiser": {
          "$ref": "common.v1.json#/$defs/template",
          "description": "Always a template; the compiler quotes it. An allow_list parameter here makes the promise iterate over the list."
        },
        "attributes": {
          "type": "object",
          "propertyNames": {
            "not": {
              "enum": [
                "if",
                "unless",
                "ifvarclass",
                "classes",
                "handle",
                "meta",
                "comment",
                "depends_on"
              ]
            },
            "pattern": "^[a-z][a-z0-9_]*$"
          },
          "additionalProperties": {
            "$ref": "common.v1.json#/$defs/expression"
          },
          "description": "CFEngine attribute -> value expression. Names the compiler sets itself (conditions, outcome classes, handles) are reserved."
        }
      }
    }
  }
}
