{
  "$schema": "./schemas/block-descriptor.v1.json",
  "schema_version": 1,
  "id": "call-method",
  "version": 1,
  "name": "Call Method",
  "category": "Methods",
  "description": "Calls a bundle outside this canvas: stdlib, a module, or hand-written CFEngine.",
  "compile_target": "own_bundle",
  "steps": [
    {
      "promise_type": "methods",
      "promiser": "{{label}}",
      "attributes": {
        "usebundle": {
          "bundle": "{{bundle_name}}",
          "args_param": "arguments"
        }
      }
    }
  ],
  "parameters": [
    {
      "name": "label",
      "label": "Label",
      "type": "string",
      "required": true
    },
    {
      "name": "bundle_name",
      "label": "Bundle name",
      "type": "string",
      "required": true,
      "allowed_chars": "a-zA-Z0-9_:",
      "help": "A bundle that already exists elsewhere — CFEngine's standard library, a cfbs module, or one you wrote by hand — e.g. \"my_bundle\" (looked up in the default namespace) or \"ns:my_bundle\". Canvas blocks call each other automatically; this isn't for that."
    },
    {
      "name": "arguments",
      "label": "Arguments",
      "type": "text",
      "required": false,
      "default": "",
      "allow_list": true,
      "help": "One per line, in the bundle's parameter order. $(…) passes a variable's value, @(…) a list."
    }
  ]
}
